{
  "$schema": "../../../../schema/enum.schema.json",
  "name": "MAV_VTOL_STATE",
  "dialect": "common",
  "compatibility": {
    "px4": {
      "default": {
        "supported": null,
        "basis": "unknown"
      }
    },
    "ardupilot": {
      "default": {
        "supported": null,
        "basis": "unknown"
      }
    }
  },
  "values": [
    {
      "name": "MAV_VTOL_STATE_UNDEFINED",
      "value": 0,
      "compatibility": {
        "px4": {
          "default": {
            "supported": null,
            "basis": "unknown"
          }
        },
        "ardupilot": {
          "default": {
            "supported": null,
            "basis": "unknown"
          }
        }
      }
    },
    {
      "name": "MAV_VTOL_STATE_TRANSITION_TO_FW",
      "value": 1,
      "compatibility": {
        "px4": {
          "default": {
            "supported": null,
            "basis": "unknown"
          }
        },
        "ardupilot": {
          "default": {
            "supported": null,
            "basis": "unknown"
          }
        }
      }
    },
    {
      "name": "MAV_VTOL_STATE_TRANSITION_TO_MC",
      "value": 2,
      "compatibility": {
        "px4": {
          "default": {
            "supported": null,
            "basis": "unknown"
          }
        },
        "ardupilot": {
          "default": {
            "supported": null,
            "basis": "unknown"
          }
        }
      }
    },
    {
      "name": "MAV_VTOL_STATE_MC",
      "value": 3,
      "compatibility": {
        "px4": {
          "default": {
            "supported": null,
            "basis": "unknown"
          }
        },
        "ardupilot": {
          "default": {
            "supported": null,
            "basis": "unknown"
          }
        }
      }
    },
    {
      "name": "MAV_VTOL_STATE_FW",
      "value": 4,
      "compatibility": {
        "px4": {
          "default": {
            "supported": null,
            "basis": "unknown"
          }
        },
        "ardupilot": {
          "default": {
            "supported": null,
            "basis": "unknown"
          }
        }
      }
    }
  ]
}
