{
  "$schema": "../../../../schema/enum.schema.json",
  "name": "VIDEO_STREAM_ENCODING",
  "dialect": "common",
  "compatibility": {
    "px4": {
      "default": {
        "supported": null,
        "basis": "unknown"
      }
    },
    "ardupilot": {
      "default": {
        "supported": null,
        "basis": "unknown"
      }
    }
  },
  "values": [
    {
      "name": "VIDEO_STREAM_ENCODING_UNKNOWN",
      "value": 0,
      "compatibility": {
        "px4": {
          "default": {
            "supported": null,
            "basis": "unknown"
          }
        },
        "ardupilot": {
          "default": {
            "supported": null,
            "basis": "unknown"
          }
        }
      }
    },
    {
      "name": "VIDEO_STREAM_ENCODING_H264",
      "value": 1,
      "compatibility": {
        "px4": {
          "default": {
            "supported": null,
            "basis": "unknown"
          }
        },
        "ardupilot": {
          "default": {
            "supported": null,
            "basis": "unknown"
          }
        }
      }
    },
    {
      "name": "VIDEO_STREAM_ENCODING_H265",
      "value": 2,
      "compatibility": {
        "px4": {
          "default": {
            "supported": null,
            "basis": "unknown"
          }
        },
        "ardupilot": {
          "default": {
            "supported": null,
            "basis": "unknown"
          }
        }
      }
    }
  ]
}
