{
  "$schema": "../../../../schema/enum.schema.json",
  "name": "STORAGE_USAGE_FLAG",
  "dialect": "common",
  "compatibility": {
    "px4": {
      "default": {
        "supported": null,
        "basis": "unknown"
      }
    },
    "ardupilot": {
      "default": {
        "supported": null,
        "basis": "unknown"
      }
    }
  },
  "values": [
    {
      "name": "STORAGE_USAGE_FLAG_SET",
      "value": 1,
      "compatibility": {
        "px4": {
          "default": {
            "supported": null,
            "basis": "unknown"
          }
        },
        "ardupilot": {
          "default": {
            "supported": null,
            "basis": "unknown"
          }
        }
      }
    },
    {
      "name": "STORAGE_USAGE_FLAG_PHOTO",
      "value": 2,
      "compatibility": {
        "px4": {
          "default": {
            "supported": null,
            "basis": "unknown"
          }
        },
        "ardupilot": {
          "default": {
            "supported": null,
            "basis": "unknown"
          }
        }
      }
    },
    {
      "name": "STORAGE_USAGE_FLAG_VIDEO",
      "value": 4,
      "compatibility": {
        "px4": {
          "default": {
            "supported": null,
            "basis": "unknown"
          }
        },
        "ardupilot": {
          "default": {
            "supported": null,
            "basis": "unknown"
          }
        }
      }
    },
    {
      "name": "STORAGE_USAGE_FLAG_LOGS",
      "value": 8,
      "compatibility": {
        "px4": {
          "default": {
            "supported": null,
            "basis": "unknown"
          }
        },
        "ardupilot": {
          "default": {
            "supported": null,
            "basis": "unknown"
          }
        }
      }
    }
  ]
}
