{
  "$schema": "../../../../schema/enum.schema.json",
  "name": "MAV_ODID_ARM_STATUS",
  "dialect": "common",
  "compatibility": {
    "px4": {
      "default": {
        "supported": null,
        "basis": "unknown"
      }
    },
    "ardupilot": {
      "default": {
        "supported": null,
        "basis": "unknown"
      }
    }
  },
  "values": [
    {
      "name": "MAV_ODID_ARM_STATUS_GOOD_TO_ARM",
      "value": 0,
      "compatibility": {
        "px4": {
          "default": {
            "supported": null,
            "basis": "unknown"
          }
        },
        "ardupilot": {
          "default": {
            "supported": null,
            "basis": "unknown"
          }
        }
      }
    },
    {
      "name": "MAV_ODID_ARM_STATUS_PRE_ARM_FAIL_GENERIC",
      "value": 1,
      "compatibility": {
        "px4": {
          "default": {
            "supported": null,
            "basis": "unknown"
          }
        },
        "ardupilot": {
          "default": {
            "supported": null,
            "basis": "unknown"
          }
        }
      }
    }
  ]
}
