{
  "$schema": "../../../../schema/enum.schema.json",
  "name": "MAV_MODE_FLAG",
  "dialect": "minimal",
  "compatibility": {
    "px4": {
      "default": {
        "supported": null,
        "basis": "unknown"
      }
    },
    "ardupilot": {
      "default": {
        "supported": null,
        "basis": "unknown"
      }
    }
  },
  "values": [
    {
      "name": "MAV_MODE_FLAG_SAFETY_ARMED",
      "value": 128,
      "compatibility": {
        "px4": {
          "default": {
            "supported": null,
            "basis": "unknown"
          }
        },
        "ardupilot": {
          "default": {
            "supported": null,
            "basis": "unknown"
          }
        }
      }
    },
    {
      "name": "MAV_MODE_FLAG_MANUAL_INPUT_ENABLED",
      "value": 64,
      "compatibility": {
        "px4": {
          "default": {
            "supported": null,
            "basis": "unknown"
          }
        },
        "ardupilot": {
          "default": {
            "supported": null,
            "basis": "unknown"
          }
        }
      }
    },
    {
      "name": "MAV_MODE_FLAG_HIL_ENABLED",
      "value": 32,
      "compatibility": {
        "px4": {
          "default": {
            "supported": null,
            "basis": "unknown"
          }
        },
        "ardupilot": {
          "default": {
            "supported": null,
            "basis": "unknown"
          }
        }
      }
    },
    {
      "name": "MAV_MODE_FLAG_STABILIZE_ENABLED",
      "value": 16,
      "compatibility": {
        "px4": {
          "default": {
            "supported": null,
            "basis": "unknown"
          }
        },
        "ardupilot": {
          "default": {
            "supported": null,
            "basis": "unknown"
          }
        }
      }
    },
    {
      "name": "MAV_MODE_FLAG_GUIDED_ENABLED",
      "value": 8,
      "compatibility": {
        "px4": {
          "default": {
            "supported": null,
            "basis": "unknown"
          }
        },
        "ardupilot": {
          "default": {
            "supported": null,
            "basis": "unknown"
          }
        }
      }
    },
    {
      "name": "MAV_MODE_FLAG_AUTO_ENABLED",
      "value": 4,
      "compatibility": {
        "px4": {
          "default": {
            "supported": null,
            "basis": "unknown"
          }
        },
        "ardupilot": {
          "default": {
            "supported": null,
            "basis": "unknown"
          }
        }
      }
    },
    {
      "name": "MAV_MODE_FLAG_TEST_ENABLED",
      "value": 2,
      "compatibility": {
        "px4": {
          "default": {
            "supported": null,
            "basis": "unknown"
          }
        },
        "ardupilot": {
          "default": {
            "supported": null,
            "basis": "unknown"
          }
        }
      }
    },
    {
      "name": "MAV_MODE_FLAG_CUSTOM_MODE_ENABLED",
      "value": 1,
      "compatibility": {
        "px4": {
          "default": {
            "supported": null,
            "basis": "unknown"
          }
        },
        "ardupilot": {
          "default": {
            "supported": null,
            "basis": "unknown"
          }
        }
      }
    }
  ]
}
